Oyun Adı,Geliştirici,Puan,Yorum Sayısı,İndirme,Kategori,Açıklama (ilk 200 karakter),Güncelleme Tarihi,Paket Adı,URL
Wordscapes,PeopleFun,4.372267,264329,"100,000,000+",Word,"💕Playing Wordscapes 10 mins a day sharpens your mind and prepares you for your daily life and challenges! 💕

This text twist of a word game is tremendous brain challenging fun. Enjoy modern word puz",1752777096,com.peoplefun.wordcross,https://play.google.com/store/apps/details?id=com.peoplefun.wordcross
Word Cookies! ®,BitMango,4.533559,537220,"50,000,000+",Word,"💕Welcome to Word Cookies! 💕

Dive into the ultimate word puzzle game and satisfy your craving for fun and challenge with Word Cookies! Whether you're a fan of word connect games or enjoy word search",1753676624,com.bitmango.go.wordcookies,https://play.google.com/store/apps/details?id=com.bitmango.go.wordcookies
Word Connect,ZenLife Games Ltd,4.7968683,160034,"50,000,000+",Word,"💕Do you enjoy the excitement of classic word games? Are you a real puzzle game master? DOWNLOAD Word Connect for FREE! Start your word story and enjoy the brainstorm NOW! 💕
 
Simply swipe the letter",1753700430,com.wordgame.words.connect,https://play.google.com/store/apps/details?id=com.wordgame.words.connect
Word Life - Crossword puzzle,Social Point,4.334576,15917,"10,000,000+",Word,"<b>A big community of players already love this crossword puzzle game. Join them today! </b>

Word Life is a relaxing crossword and anagram game. Connect letters to spell words and expand your vocab",1753184948,es.socialpoint.wordlife,https://play.google.com/store/apps/details?id=es.socialpoint.wordlife
Word Calm - Scape puzzle game,FUNJOY,4.429158,10445,"1,000,000+",Word,"Do you love the excitement of classic word games? Search and connect the letter the right way to create a word. DOWNLOAD Word Calm for FREE! Come challenge now.

Word Calm is a crossword puzzle game",1749728616,com.wordgame.cross.android.en,https://play.google.com/store/apps/details?id=com.wordgame.cross.android.en
